{
  "name": "hello-world-workflow",
  "version": "1.0",
  "tool_definitions": [],
  "nodes": [
    {
      "id": "orchestrator",
      "type": "Orchestrator",
      "config": {
        "name": "Main Orchestrator",
        "system_prompt": "You coordinate the workflow.",
        "model": {"provider": "openai", "model": "gpt-4.1-mini"},
        "tools": []
      }
    },
    {
      "id": "hello-agent",
      "type": "Specialist",
      "config": {
        "name": "Hello Agent",
        "system_prompt": "You greet users with Hello, world!",
        "model": {"provider": "openai", "model": "gpt-4.1-mini"},
        "tools": []
      }
    }
  ],
  "edges": [
    {"source": "orchestrator", "target": "hello-agent", "type": "specialists"}
  ]
}
